{
  "schema_version": "slot-alignment.sensitivity-result.v6",
  "task_id": "<task-id>",
  "sensitivity_plan_sha256": "<sha256>",
  "metric_contract_sha256": "<sha256>",
  "runtime_bundle_sha256": "<sha256>",
  "status": "completed",
  "observations": [
    {"parameter_id": "<parameter-id>", "direction_zh": "<direction>", "impact_by_metric": {"N1.total_rtp.overall": 0.0}, "risk_zh": "<risk>", "recommended_search_layer": "<layer-id>"}
  ],
  "completed_at": "<ISO-8601>"
}
